[
  {
    "id": "salicylic-acid",
    "inci_name": "Salicylic Acid",
    "common_name": "Salicylic Acid",
    "also_known_as": [
      "BHA",
      "Beta Hydroxy Acid"
    ],
    "category": [
      "Exfoliant",
      "BHA",
      "Anti-acne"
    ],
    "description": "An oil-soluble beta-hydroxy acid that penetrates pores to dissolve sebum and dead skin.",
    "benefits": [
      "Unclogs and shrinks pores",
      "Reduces blackheads and breakouts",
      "Controls oil",
      "Anti-inflammatory"
    ],
    "skin_types": [
      "oily",
      "acne-prone",
      "combination"
    ],
    "concerns": [
      "Can over-dry skin",
      "Mild photosensitivity"
    ],
    "comedogenic_rating": 0,
    "irritancy": "medium",
    "pregnancy_safe": "caution",
    "vegan": "yes",
    "origin": "both",
    "typical_concentration": "0.5-2%",
    "ph_range": "3.0-4.0",
    "time_of_use": "AM/PM",
    "evidence_level": "strong",
    "pairs_well_with": [
      "Niacinamide",
      "Hyaluronic Acid",
      "Zinc"
    ],
    "avoid_with": [
      "Retinol",
      "Ascorbic Acid (Vitamin C)",
      "Glycolic Acid",
      "Benzoyl Peroxide"
    ]
  }
]